{
  "id": "variety-arwen-259cf657",
  "record_type": "entity",
  "entity_type": "variety",
  "name": "Arwen",
  "aliases": [],
  "status": "unverified",
  "description": "Catalog identity admitted from the cited source. Agronomic, commercial and legal claims remain subject to review.",
  "roles": [
    "cultivar"
  ],
  "berry_ids": [
    "berry-strawberry"
  ],
  "evidence_ids": [],
  "fact_ids": [],
  "relationship_ids": [],
  "attributes": {
    "catalog_candidate_id": "vcand-6f1712476128",
    "identity_review": {
      "reviewer": "Codex — user-authorized identity audit",
      "reviewed_at": "2026-10-28T03:55:28.173326+00:00",
      "authorization": "User selected: promote clear, source-backed identities; retain ambiguous cases. Catalog identity only; no claim/alias/role/rights approval.",
      "source_url": "https://www.berriesdeloeste.com/",
      "source_label": "Berries del Oeste — original current variety menu",
      "candidate_name": "Arwen"
    }
  }
}
