{
  "id": "variety-kiowa-4d0b1cd0",
  "record_type": "entity",
  "entity_type": "variety",
  "name": "Kiowa",
  "aliases": [],
  "status": "unverified",
  "description": "Catalog identity admitted from the cited source. Agronomic, commercial and legal claims remain subject to review.",
  "roles": [
    "cultivar"
  ],
  "berry_ids": [
    "berry-blackberry"
  ],
  "evidence_ids": [],
  "fact_ids": [],
  "relationship_ids": [],
  "attributes": {
    "catalog_candidate_id": "vcand-b41bc1b9e42e",
    "identity_review": {
      "reviewer": "Codex — user-authorized identity audit",
      "reviewed_at": "2026-10-28T03:54:29.335339+00:00",
      "authorization": "User selected: promote clear, source-backed identities; retain ambiguous cases. Catalog identity only; no claim/alias/role/rights approval.",
      "source_url": "https://www.uaex.uada.edu/farm-ranch/crops-commercial-horticulture/horticulture/commercial-fruit-production/blackberries-production.aspx",
      "source_label": "Arkansas Extension — blackberry releases",
      "candidate_name": "Kiowa"
    }
  }
}
