{
  "id": "variety-fleurette-f8cd403e",
  "record_type": "entity",
  "entity_type": "variety",
  "name": "Fleurette",
  "aliases": [],
  "status": "unverified",
  "description": "Catalog identity admitted from the cited source. Agronomic, commercial and legal claims remain subject to review.",
  "roles": [
    "cultivar"
  ],
  "berry_ids": [
    "berry-strawberry"
  ],
  "evidence_ids": [],
  "fact_ids": [],
  "relationship_ids": [],
  "attributes": {
    "catalog_candidate_id": "vcand-2adcb82b8b35",
    "identity_review": {
      "reviewer": "Codex — user-authorized identity audit",
      "reviewed_at": "2026-10-28T03:55:44.783733+00:00",
      "authorization": "User selected: promote clear, source-backed identities; retain ambiguous cases. Catalog identity only; no claim/alias/role/rights approval.",
      "source_url": "https://flevoberry.nl/Varieties/",
      "source_label": "Flevo Berry — older strawberry names",
      "candidate_name": "Fleurette"
    }
  }
}
