{
  "id": "variety-vajolet-58429604",
  "record_type": "entity",
  "entity_type": "variety",
  "name": "Vajolet",
  "aliases": [],
  "status": "unverified",
  "description": "Catalog identity admitted from the cited source. Agronomic, commercial and legal claims remain subject to review.",
  "roles": [
    "cultivar"
  ],
  "berry_ids": [
    "berry-raspberry"
  ],
  "evidence_ids": [],
  "fact_ids": [],
  "relationship_ids": [],
  "attributes": {
    "catalog_candidate_id": "vcand-e5d33fe559e4",
    "identity_review": {
      "reviewer": "Codex — user-authorized identity audit",
      "reviewed_at": "2026-10-28T03:55:21.963943+00:00",
      "authorization": "User selected: promote clear, source-backed identities; retain ambiguous cases. Catalog identity only; no claim/alias/role/rights approval.",
      "source_url": "https://www.santorsola.com/sperimentazione-e-breeding/",
      "source_label": "Sant’Orsola — named raspberry breeding list",
      "candidate_name": "Vajolet"
    }
  }
}
