{
  "id": "variety-regina-cff23d3a",
  "record_type": "entity",
  "entity_type": "variety",
  "name": "Regina",
  "aliases": [],
  "status": "unverified",
  "description": "Catalog identity admitted from the cited source. Agronomic, commercial and legal claims remain subject to review.",
  "roles": [
    "cultivar"
  ],
  "berry_ids": [
    "berry-blackberry"
  ],
  "evidence_ids": [],
  "fact_ids": [],
  "relationship_ids": [],
  "attributes": {
    "catalog_candidate_id": "vcand-3dbb53c7cfec",
    "identity_review": {
      "reviewer": "Codex — user-authorized identity audit",
      "reviewed_at": "2026-10-28T03:54:31.270360+00:00",
      "authorization": "User selected: promote clear, source-backed identities; retain ambiguous cases. Catalog identity only; no claim/alias/role/rights approval.",
      "source_url": "https://blackventurefarm.com/#page-3",
      "source_label": "Black Venture Farm — original low-chill varieties",
      "candidate_name": "Regina"
    }
  }
}
