{
  "id": "variety-megacrisp-2ce3d648",
  "record_type": "entity",
  "entity_type": "variety",
  "name": "MEGACRISP",
  "aliases": [],
  "status": "unverified",
  "description": "Catalog identity admitted from the cited source. Agronomic, commercial and legal claims remain subject to review.",
  "roles": [
    "cultivar"
  ],
  "berry_ids": [
    "berry-blueberry"
  ],
  "evidence_ids": [],
  "fact_ids": [],
  "relationship_ids": [],
  "attributes": {
    "catalog_candidate_id": "vcand-2a3f6705aacf",
    "identity_review": {
      "reviewer": "Codex — user-authorized identity audit",
      "reviewed_at": "2026-10-28T03:54:46.160285+00:00",
      "authorization": "User selected: promote clear, source-backed identities; retain ambiguous cases. Catalog identity only; no claim/alias/role/rights approval.",
      "source_url": "https://iqberries.com/",
      "source_label": "IQ Berries — original blueberry portfolio",
      "candidate_name": "MEGACRISP"
    }
  }
}
