{
  "id": "variety-marisma-fnm-5976b2f0",
  "record_type": "entity",
  "entity_type": "variety",
  "name": "Marisma FNM",
  "aliases": [],
  "status": "unverified",
  "description": "Catalog identity admitted from the cited source. Agronomic, commercial and legal claims remain subject to review.",
  "roles": [
    "cultivar"
  ],
  "berry_ids": [
    "berry-strawberry"
  ],
  "evidence_ids": [],
  "fact_ids": [],
  "relationship_ids": [],
  "attributes": {
    "catalog_candidate_id": "vcand-2dcdc92f1048",
    "identity_review": {
      "reviewer": "Codex — user-authorized identity audit",
      "reviewed_at": "2026-10-28T03:55:59.930154+00:00",
      "authorization": "User selected: promote clear, source-backed identities; retain ambiguous cases. Catalog identity only; no claim/alias/role/rights approval.",
      "source_url": "https://www.fresasnm.com/variedades-fnm/",
      "source_label": "FNM — strawberry and raspberry catalog index",
      "candidate_name": "Marisma FNM"
    }
  }
}
