{
  "id": "variety-stolo-53c9ca72",
  "record_type": "entity",
  "entity_type": "variety",
  "name": "Stolo",
  "aliases": [],
  "status": "unverified",
  "description": "Catalog identity admitted from the cited source. Agronomic, commercial and legal claims remain subject to review.",
  "roles": [
    "cultivar"
  ],
  "berry_ids": [
    "berry-strawberry"
  ],
  "evidence_ids": [],
  "fact_ids": [],
  "relationship_ids": [],
  "attributes": {
    "catalog_candidate_id": "vcand-065c5c1b5e31",
    "identity_review": {
      "reviewer": "Codex — user-authorized identity audit",
      "reviewed_at": "2026-10-28T03:56:17.095634+00:00",
      "authorization": "User selected: promote clear, source-backed identities; retain ambiguous cases. Catalog identity only; no claim/alias/role/rights approval.",
      "source_url": "https://plantbreeding.oregonstate.edu/plantbreeding/research/small-fruit-breeding-program",
      "source_label": "Oregon State University — historical strawberry releases",
      "candidate_name": "Stolo"
    }
  }
}
