{
  "id": "variety-finnberry-b0938762",
  "record_type": "entity",
  "entity_type": "variety",
  "name": "Finnberry",
  "aliases": [],
  "status": "unverified",
  "description": "Catalog identity admitted from the cited source. Agronomic, commercial and legal claims remain subject to review.",
  "roles": [
    "cultivar"
  ],
  "berry_ids": [
    "berry-raspberry"
  ],
  "evidence_ids": [],
  "fact_ids": [],
  "relationship_ids": [],
  "attributes": {
    "catalog_candidate_id": "vcand-6d4c21d3c1d6",
    "identity_review": {
      "reviewer": "Codex — user-authorized identity audit",
      "reviewed_at": "2026-10-28T03:55:06.538103+00:00",
      "authorization": "User selected: promote clear, source-backed identities; retain ambiguous cases. Catalog identity only; no claim/alias/role/rights approval.",
      "source_url": "https://www.ars.usda.gov/research/project?accnNo=434214&fy=2022",
      "source_label": "USDA ARS Corvallis — FY2022 berry program report",
      "candidate_name": "Finnberry"
    }
  }
}
