{
  "id": "variety-cascade-bounty-09c5b9d1",
  "record_type": "entity",
  "entity_type": "variety",
  "name": "Cascade Bounty",
  "aliases": [],
  "status": "unverified",
  "description": "Catalog identity admitted from the cited source. Agronomic, commercial and legal claims remain subject to review.",
  "roles": [
    "cultivar"
  ],
  "berry_ids": [
    "berry-raspberry"
  ],
  "evidence_ids": [],
  "fact_ids": [],
  "relationship_ids": [],
  "attributes": {
    "catalog_candidate_id": "vcand-6dbb4a2db48b",
    "identity_review": {
      "reviewer": "Codex — user-authorized identity audit",
      "reviewed_at": "2026-10-28T03:55:00.246605+00:00",
      "authorization": "User selected: promote clear, source-backed identities; retain ambiguous cases. Catalog identity only; no claim/alias/role/rights approval.",
      "source_url": "https://plantbreeding.oregonstate.edu/plantbreeding/research/small-fruit-breeding-program",
      "source_label": "Oregon State University — historical raspberry releases",
      "candidate_name": "Cascade Bounty"
    }
  }
}
