{
  "id": "variety-bella",
  "record_type": "entity",
  "entity_type": "variety",
  "name": "Bella",
  "aliases": [
    "EB 8-46",
    "OZblu Bella",
    "'EB 8-46'"
  ],
  "status": "active",
  "description": "Blueberry cultivar from the selection 'EB 8-46', bred in Western Australia by Vincent David Mazzardis and marketed internationally under the OZblu brand by United Exports. Protected in the United States by US PP26,173, granted 2015-12-01. Parentage 'BB-5' (unpatented) x 'SB-1' (unpatented).",
  "roles": [
    "cultivar"
  ],
  "berry_ids": [
    "berry-blueberry"
  ],
  "evidence_ids": [
    "ev-uspp026173-eb8-46",
    "ev-ciopora-united-exports-pbr-2020"
  ],
  "fact_ids": [
    "fact-ozblu-identity-bella"
  ],
  "relationship_ids": [
    "rel-united-exports-sells-bella"
  ],
  "attributes": {
    "selection_code": "EB 8-46",
    "patent_id": "patent-uspp026173p3",
    "patent_number": "US PP26,173",
    "patent_grant_date": "2015-12-01",
    "parentage": "'BB-5' (unpatented) x 'SB-1' (unpatented)",
    "cross_location": "Yanchep Springs, Yanchep, Western Australia",
    "breeder_individual": "Vincent David Mazzardis",
    "breeding_organisation": "Nature Select / Next Progeny / Prunus Persica (Australia)",
    "marketed_under_brand": "OZblu",
    "brand_owner": "United Exports",
    "code_to_name_corroboration": "The selection code to commercial name mapping is corroborated by the South African Department of Agriculture, Land Reform and Rural Development berry export variety list 2025, independently of the rights holder.",
    "identity_note": "This is a breeder selection code and a marketed cultivar name for the same object, confirmed by the patent record. OZblu is the brand under which it is sold and is not itself a cultivar.",
    "cross_season": "2005",
    "traits": []
  }
}
