{
  "id": "retailer-waitrose",
  "record_type": "entity",
  "entity_type": "retailer",
  "name": "Waitrose",
  "aliases": [
    "Waitrose & Partners"
  ],
  "status": "active",
  "description": "Major UK grocery retailer. Added for the Variety Intelligence Backbone V1 mission (2026-08-21) UK retail commercial-observation pilot -- a real, well-known retail chain, not fabricated.",
  "roles": [
    "grocery_retailer"
  ],
  "berry_ids": [],
  "evidence_ids": [],
  "fact_ids": [],
  "relationship_ids": [],
  "attributes": {
    "country": "United Kingdom"
  }
}
