{
  "id": "variety-sweet-eve-12640f19",
  "record_type": "entity",
  "entity_type": "variety",
  "name": "Sweet Eve",
  "aliases": [],
  "status": "unverified",
  "description": "Catalog identity admitted from the cited source. Agronomic, commercial and legal claims remain subject to review.",
  "roles": [
    "cultivar"
  ],
  "berry_ids": [
    "berry-strawberry"
  ],
  "evidence_ids": [],
  "fact_ids": [],
  "relationship_ids": [],
  "attributes": {
    "catalog_candidate_id": "vcand-98a9db5a871d",
    "identity_review": {
      "reviewer": "Codex — user-authorized identity audit",
      "reviewed_at": "2026-10-28T03:56:20.046346+00:00",
      "authorization": "User selected: promote clear, source-backed identities; retain ambiguous cases. Catalog identity only; no claim/alias/role/rights approval.",
      "source_url": "https://www.berryworld.com/en-za/berries/varieties",
      "source_label": "BerryWorld South Africa — strawberry list",
      "candidate_name": "Sweet Eve"
    }
  }
}
